{
  "id": "vending-ghost",
  "name": "The Vending-Light Ghost",
  "type": "spirit",
  "register": "Hunger",
  "grade": "D",
  "description": "a thin Hunger residue",
  "hp": 11,
  "atk": 4,
  "exorcise_dc": 8,
  "anchor": "the last coin it ever spent",
  "loot": {
    "money": {
      "chance": 1.0,
      "min": 800,
      "max": 3500
    },
    "cigarettes": {
      "chance": 0.3,
      "qty": [
        1,
        3
      ],
      "effect": "madness -3..-6"
    },
    "tickets": {
      "chance": 0.45,
      "min": 1,
      "max": 3
    },
    "trappedSpirit": {
      "chance": 0.02,
      "becomes": "artifact (the spirit bound in the object)"
    },
    "cursedJewelry": {
      "chance": 0.06,
      "becomes": "low-power artifact · thins the veil slightly around the bearer"
    }
  },
  "extra": {
    "absorb": "a thin Hunger residue",
    "tip": "It watches who buys from the machine at 3am, and who only pretends to.",
    "tier": 1
  }
}