{
  "id": "riot-that-remembers",
  "name": "The Riot That Remembers",
  "type": "idea",
  "register": "Rage",
  "grade": "A",
  "description": "catastrophic · you become the crowd's first voice",
  "hp": 60,
  "atk": 18,
  "exorcise_dc": 24,
  "anchor": "the night the street last burned",
  "loot": {
    "money": {
      "chance": 1.0,
      "min": 15000,
      "max": 40000
    },
    "cigarettes": {
      "chance": 0.7,
      "qty": [
        1,
        3
      ],
      "effect": "madness -3..-6"
    },
    "tickets": {
      "chance": 0.8,
      "min": 6,
      "max": 14
    },
    "trappedSpirit": {
      "chance": 0.02,
      "becomes": "artifact (the spirit bound in the object)"
    },
    "cursedJewelry": {
      "chance": 0.16,
      "becomes": "low-power artifact · thins the veil slightly around the bearer"
    },
    "premium": {
      "chance": 0.07,
      "choose": true,
      "note": "player-chooseable premium object carried by this premium vessel"
    }
  },
  "extra": {
    "absorb": "catastrophic · you become the crowd's first voice",
    "tip": "It gathers where many have been angry in the same place. Kabukichō remembers.",
    "tier": 4
  }
}