{
  "id": "tunnel-that-turns",
  "name": "The Tunnel That Turns",
  "type": "spirit",
  "register": "Fear",
  "grade": "C",
  "description": "a Fear residue, cold and patient",
  "hp": 26,
  "atk": 10,
  "exorcise_dc": 15,
  "anchor": "the hour the underpass stops being a tunnel",
  "loot": {
    "money": {
      "chance": 1.0,
      "min": 2500,
      "max": 8000
    },
    "cigarettes": {
      "chance": 0.4,
      "qty": [
        1,
        3
      ],
      "effect": "madness -3..-6"
    },
    "tickets": {
      "chance": 0.55,
      "min": 2,
      "max": 5
    },
    "trappedSpirit": {
      "chance": 0.02,
      "becomes": "artifact (the spirit bound in the object)"
    },
    "cursedJewelry": {
      "chance": 0.09,
      "becomes": "low-power artifact · thins the veil slightly around the bearer"
    }
  },
  "extra": {
    "absorb": "a Fear residue, cold and patient",
    "tip": "Sato the busker has mapped its moods by ear; ask him when it turns.",
    "tier": 3
  }
}