{
  "id": "open-mouth-oji",
  "name": "The Open Mouth of Ōji",
  "type": "demon",
  "register": "Hunger",
  "grade": "A",
  "description": "+a deep Hunger-path residue · a real step toward the Thirteen",
  "hp": 66,
  "atk": 20,
  "exorcise_dc": 25,
  "anchor": "its true name, spoken in the order it was forgotten",
  "loot": {
    "money": {
      "chance": 1.0,
      "min": 15000,
      "max": 40000
    },
    "cigarettes": {
      "chance": 0.7,
      "qty": [
        1,
        3
      ],
      "effect": "madness -3..-6"
    },
    "tickets": {
      "chance": 0.8,
      "min": 6,
      "max": 14
    },
    "trappedSpirit": {
      "chance": 0.02,
      "becomes": "artifact (the spirit bound in the object)"
    },
    "cursedJewelry": {
      "chance": 0.16,
      "becomes": "low-power artifact · thins the veil slightly around the bearer"
    },
    "premium": {
      "chance": 0.07,
      "choose": true,
      "note": "player-chooseable premium object carried by this premium vessel"
    }
  },
  "extra": {
    "absorb": "+a deep Hunger-path residue · a real step toward the Thirteen",
    "tip": "It has been eating the district slowly for years; Old Tomi knows what crosses the fence to feed it.",
    "tier": 4
  }
}