{
  "id": "platform-shover",
  "name": "The Platform Shover",
  "type": "spirit",
  "register": "Rage",
  "grade": "D",
  "description": "a thin Rage residue, sour and quick",
  "hp": 12,
  "atk": 5,
  "exorcise_dc": 9,
  "anchor": "the name of the man it was, the morning it jumped",
  "loot": {
    "money": {
      "chance": 1.0,
      "min": 800,
      "max": 3500
    },
    "cigarettes": {
      "chance": 0.3,
      "qty": [
        1,
        3
      ],
      "effect": "madness -3..-6"
    },
    "tickets": {
      "chance": 0.45,
      "min": 1,
      "max": 3
    },
    "trappedSpirit": {
      "chance": 0.02,
      "becomes": "artifact (the spirit bound in the object)"
    },
    "cursedJewelry": {
      "chance": 0.06,
      "becomes": "low-power artifact · thins the veil slightly around the bearer"
    }
  },
  "extra": {
    "absorb": "a thin Rage residue, sour and quick",
    "tip": "It remembers every face that did not pull it back from the edge.",
    "tier": 1
  }
}