{
  "id": "the-vacancy",
  "name": "The Vacancy",
  "type": "idea",
  "register": "Duty",
  "grade": "top",
  "description": "you cannot absorb the empty seat — it absorbs toward itself",
  "hp": 95,
  "atk": 23,
  "exorcise_dc": 31,
  "anchor": "the year the Thirteenth Duty seat fell vacant",
  "loot": {
    "money": {
      "chance": 1.0,
      "min": 40000,
      "max": 120000
    },
    "cigarettes": {
      "chance": 0.9,
      "qty": [
        1,
        3
      ],
      "effect": "madness -3..-6"
    },
    "tickets": {
      "chance": 1.0,
      "min": 12,
      "max": 30
    },
    "trappedSpirit": {
      "chance": 0.02,
      "becomes": "artifact (the spirit bound in the object)"
    },
    "cursedJewelry": {
      "chance": 0.22,
      "becomes": "low-power artifact · thins the veil slightly around the bearer"
    },
    "premium": {
      "chance": 0.12,
      "choose": true,
      "note": "player-chooseable premium object carried by this premium vessel"
    }
  },
  "extra": {
    "absorb": "you cannot absorb the empty seat — it absorbs toward itself",
    "tip": "It is not a creature so much as a pull: the open wound where Duty has no holder. Yushiro means to close it. So does the cult, differently.",
    "tier": 5
  }
}