{
  "id": "mirror-averted",
  "name": "The Mirror-Averted",
  "type": "spirit",
  "register": "Shame",
  "grade": "D",
  "description": "a thin Shame residue; it clings",
  "hp": 10,
  "atk": 4,
  "exorcise_dc": 10,
  "anchor": "the thing it could not bear to be seen doing",
  "loot": {
    "money": {
      "chance": 1.0,
      "min": 800,
      "max": 3500
    },
    "cigarettes": {
      "chance": 0.3,
      "qty": [
        1,
        3
      ],
      "effect": "madness -3..-6"
    },
    "tickets": {
      "chance": 0.45,
      "min": 1,
      "max": 3
    },
    "trappedSpirit": {
      "chance": 0.02,
      "becomes": "artifact (the spirit bound in the object)"
    },
    "cursedJewelry": {
      "chance": 0.06,
      "becomes": "low-power artifact · thins the veil slightly around the bearer"
    }
  },
  "extra": {
    "absorb": "a thin Shame residue; it clings",
    "tip": "Look at it directly and it cannot speak. Look away and it tells you everything.",
    "tier": 1
  }
}