{
  "id": "thing-in-the-torii",
  "name": "The Thing in the Torii",
  "type": "spirit",
  "register": "Awe",
  "grade": "A",
  "description": "a vast Awe residue · it humbles more than it empowers",
  "hp": 58,
  "atk": 17,
  "exorcise_dc": 26,
  "anchor": "the two-hundred-year vow the shrine was built to keep",
  "loot": {
    "money": {
      "chance": 1.0,
      "min": 15000,
      "max": 40000
    },
    "cigarettes": {
      "chance": 0.7,
      "qty": [
        1,
        3
      ],
      "effect": "madness -3..-6"
    },
    "tickets": {
      "chance": 0.8,
      "min": 6,
      "max": 14
    },
    "trappedSpirit": {
      "chance": 0.02,
      "becomes": "artifact (the spirit bound in the object)"
    },
    "cursedJewelry": {
      "chance": 0.16,
      "becomes": "low-power artifact · thins the veil slightly around the bearer"
    },
    "premium": {
      "chance": 0.07,
      "choose": true,
      "note": "player-chooseable premium object carried by this premium vessel"
    }
  },
  "extra": {
    "absorb": "a vast Awe residue · it humbles more than it empowers",
    "tip": "Miyamoto's shrine has held it at the boundary for generations; the wards are wearing thin.",
    "tier": 4
  }
}